{
  "iv_context": "encouragement",
  "instrument_type": "randomized_encouragement",
  "treatment_type": "binary",
  "outcome_type": "continuous",
  "target_estimand": "cace_late",
  "instrument_strength": "moderate",
  "first_stage_f": 18.5,
  "n_instruments": 1,
  "n_endogenous": 1,
  "exclusion_risk": "moderate",
  "independence_risk": "low",
  "monotonicity_risk": "low",
  "many_instruments": false,
  "clustered": true,
  "needs_fixed_effects": false,
  "high_dimensional_controls": false,
  "nonlinear_target": false,
  "mendelian_randomization": false,
  "mr_pleiotropy_risk": "unknown",
  "sample_size": 3000,
  "language": "either"
}
